#,Text,Gloss,NpyFilesRoot
376,can you give more details about palliative care options?,"PALLIATIVE CARE OPTIONS, MORE DETAILS CAN?","/PALLIATIVE CARE OPTIONS, MORE DETAILS CAN?/*.npy"
377,can you help in scheduling the rehabilitation sessions?,"REHABILITATION SESSIONS, SCHEDULE HELP CAN YOU?","/REHABILITATION SESSIONS, SCHEDULE HELP CAN YOU?/*.npy"
378,can you help me manage my chronic pain?,CHRONIC PAIN MANAGE HELP CAN YOU?,/CHRONIC PAIN MANAGE HELP CAN YOU?/*.npy
379,can you help me schedule my rehabilitation sessions?,"REHABILITATION SESSIONS, SCHEDULE HELP CAN YOU?","/REHABILITATION SESSIONS, SCHEDULE HELP CAN YOU?/*.npy"
380,can you help me understand my surgery consent form?,"SURGERY CONSENT FORM, UNDERSTAND HELP NEED I","/SURGERY CONSENT FORM, UNDERSTAND HELP NEED I/*.npy"
381,can you help me understand the importance of each medication they're taking?,"MEDICATION EACH, IMPORTANCE UNDERSTAND HELP, CAN YOU?","/MEDICATION EACH, IMPORTANCE UNDERSTAND HELP, CAN YOU?/*.npy"
382,Can you help me understand the importance of each medication?,"MEDICATION EACH, IMPORTANCE UNDERSTAND HELP, CAN YOU?","/MEDICATION EACH, IMPORTANCE UNDERSTAND HELP, CAN YOU?/*.npy"
383,can you help me understand the medication schedule they're on?,"MEDICATION SCHEDULE THEIR, UNDERSTAND HELP ME","/MEDICATION SCHEDULE THEIR, UNDERSTAND HELP ME/*.npy"
384,can you help me understand the recent tests results?,"TESTS RECENT, RESULTS UNDERSTAND HELP","/TESTS RECENT, RESULTS UNDERSTAND HELP/*.npy"
385,Can you help me understand their medication schedule?,"MEDICATION SCHEDULE THEIR, UNDERSTAND HELP ME","/MEDICATION SCHEDULE THEIR, UNDERSTAND HELP ME/*.npy"
386,can you help me understand their treatment goals?,"TREATMENT GOALS THEIR, UNDERSTAND HELP CAN?","/TREATMENT GOALS THEIR, UNDERSTAND HELP CAN?/*.npy"
387,can you help us understand the goals of their current treatment?,"TREATMENT GOALS THEIR, UNDERSTAND HELP CAN?","/TREATMENT GOALS THEIR, UNDERSTAND HELP CAN?/*.npy"
388,can you help us understand the results of their recent tests?,"TESTS RECENT, RESULTS UNDERSTAND HELP","/TESTS RECENT, RESULTS UNDERSTAND HELP/*.npy"
389,Can you maintain a healthy weight?,HEALTHY WEIGHT MAINTAIN CAN YOU?,/HEALTHY WEIGHT MAINTAIN CAN YOU/*.npy
390,Can you manage daily life alone?,DAILY LIFE MANAGE ALONE CAN YOU?,/DAILY LIFE MANAGE ALONE CAN YOU/*.npy
391,Can you move around comfortably?,MOVE AROUND COMFORTABLE CAN YOU?,/MOVE AROUND COMFORTABLE CAN YOU/*.npy
392,Can you point to where it hurts?,HURT WHERE? POINT CAN YOU?,/HURT WHERE? POINT CAN YOU/*.npy
393,can you provide a brief medical history?,MEDICAL HISTORY BRIEF CAN YOU GIVE?,/MEDICAL HISTORY BRIEF CAN YOU GIVE?/*.npy
394,can you provide a cheaper alternative to this medicine?,CHEAPER ALTERNATIVE THIS MEDICINE PROVIDE CAN YOU?,/CHEAPER ALTERNATIVE THIS MEDICINE PROVIDE CAN YOU?/*.npy
395,can you provide a list of all the supplements and vitamins you're taking?,SUPPLEMENT VITAMIN LIST CAN GIVE?,/SUPPLEMENT VITAMIN LIST CAN GIVE?/*.npy
396,can you provide a low-impact exercise routine for me?,"LOW-IMPACT EXERCISE, ROUTINE PROVIDE CAN YOU?","/LOW-IMPACT EXERCISE, ROUTINE PROVIDE CAN YOU?/*.npy"
397,Can you provide a more affordable alternative to this medication?,CHEAPER ALTERNATIVE THIS MEDICINE PROVIDE CAN YOU?,/CHEAPER ALTERNATIVE THIS MEDICINE PROVIDE CAN YOU?/*.npy
398,can you provide any feedback on your experience with our medical facility so far?,FACILITY MEDICAL EXPERIENCE FEEDBACK CAN GIVE?,/FACILITY MEDICAL EXPERIENCE FEEDBACK CAN GIVE?/*.npy
399,can you provide details of any family history of this condition?,FAMILY HISTORY CONDITION DETAIL CAN GIVE?,/FAMILY HISTORY CONDITION DETAIL CAN GIVE?/*.npy
400,can you provide details of your previous treatments for this condition?,TREATMENT PAST DETAIL CAN GIVE?,/TREATMENT PAST DETAIL CAN GIVE?/*.npy
401,can you provide information on how to prevent complications?,"COMPLICATIONS PREVENT, INFORMATION PROVIDE CAN?","/COMPLICATIONS PREVENT, INFORMATION PROVIDE CAN?/*.npy"
402,can you provide information on support groups for this condition?,"SUPPORT GROUPS, CONDITION THIS, INFORMATION CAN?","/SUPPORT GROUPS, CONDITION THIS, INFORMATION CAN?/*.npy"
403,Can you provide instructions for managing medications?,"MEDICATION MANAGEMENT, INSTRUCTIONS PROVIDE CAN?","/MEDICATION MANAGEMENT, INSTRUCTIONS PROVIDE CAN?/*.npy"
404,can you provide instructions for medication management at home?,"MEDICATION MANAGEMENT, INSTRUCTIONS PROVIDE CAN?","/MEDICATION MANAGEMENT, INSTRUCTIONS PROVIDE CAN?/*.npy"
405,Can you provide me with a low-impact exercise routine?,"LOW-IMPACT EXERCISE, ROUTINE PROVIDE CAN YOU?","/LOW-IMPACT EXERCISE, ROUTINE PROVIDE CAN YOU?/*.npy"
406,can you provide more details about palliative care options?,"PALLIATIVE CARE OPTIONS, MORE DETAILS CAN?","/PALLIATIVE CARE OPTIONS, MORE DETAILS CAN?/*.npy"
407,Can you provide more information about this clinical trial?,"CLINICAL TRIAL THIS, MORE INFORMATION PROVIDE CAN YOU?","/CLINICAL TRIAL THIS, MORE INFORMATION PROVIDE CAN YOU?/*.npy"
408,Can you provide more information on preventing complications?,"COMPLICATIONS PREVENT, INFORMATION PROVIDE CAN?","/COMPLICATIONS PREVENT, INFORMATION PROVIDE CAN?/*.npy"
409,can you provide more information on this clinical trial?,"CLINICAL TRIAL THIS, MORE INFORMATION PROVIDE CAN YOU?","/CLINICAL TRIAL THIS, MORE INFORMATION PROVIDE CAN YOU?/*.npy"
410,Can you provide the names of any doctors you’ve seen before?,DOCTOR PAST NAME ANY PROVIDE CAN YOU?,/DOCTOR PAST NAME ANY PROVIDE CAN YOU?/*.npy
411,can you provide the names of any previous doctors you've seen?,DOCTOR PAST NAME ANY PROVIDE CAN YOU?,/DOCTOR PAST NAME ANY PROVIDE CAN YOU?/*.npy
412,can you provide tips on managing stress related to caregiving?,"STRESS CAREGIVING, MANAGING TIPS PROVIDE CAN?","/STRESS CAREGIVING, MANAGING TIPS PROVIDE CAN?/*.npy"
413,can you provide tips to manage stress of caregiving?,"STRESS CAREGIVING, MANAGING TIPS PROVIDE CAN?","/STRESS CAREGIVING, MANAGING TIPS PROVIDE CAN?/*.npy"
414,can you rate your pain on a scale from 1 to 10?,PAIN YOURS RATE SCALE 1-10 CAN?,/PAIN YOURS RATE SCALE 1-10 CAN?/*.npy
415,can you rate your pain on scale from 1 to 10?,PAIN YOURS RATE SCALE 1-10 CAN?,/PAIN YOURS RATE SCALE 1-10 CAN?/*.npy
416,can you recommend any resources for financial assistance with medical expenses?,"MEDICAL EXPENSES, FINANCIAL ASSISTANCE, RESOURCES RECOMMEND CAN?","/MEDICAL EXPENSES, FINANCIAL ASSISTANCE, RESOURCES RECOMMEND CAN?/*.npy"
417,Can you recommend resources for financial help with medical expenses?,"MEDICAL EXPENSES, FINANCIAL ASSISTANCE, RESOURCES RECOMMEND CAN?","/MEDICAL EXPENSES, FINANCIAL ASSISTANCE, RESOURCES RECOMMEND CAN?/*.npy"
418,can you show me how to change this badage?,"BANDAGE CHANGE HOW, SHOW CAN YOU?","/BANDAGE CHANGE HOW, SHOW CAN YOU?/*.npy"
419,Can you show me how to check my blood pressure?,"BLOOD PRESSURE MONITOR HOW, SHOW CAN YOU?","/BLOOD PRESSURE MONITOR HOW, SHOW CAN YOU?/*.npy"
420,can you show me how to monitor my blood pressure at home?,"BLOOD PRESSURE MONITOR HOW, SHOW CAN YOU?","/BLOOD PRESSURE MONITOR HOW, SHOW CAN YOU?/*.npy"
421,can you show me how to properly care for their wound at home?,"WOUND CARE HOW, SHOW ME","/WOUND CARE HOW, SHOW ME/*.npy"
422,Can you show me how to use my inhaler?,INHALER USE HOW SHOW ME CAN YOU?,/INHALER USE HOW SHOW ME CAN YOU/*.npy
423,Can you sleep through the night with no interruptions?,"NIGHT SLEEP INTERRUPT NONE, CAN YOU?","/NIGHT SLEEP INTERRUPT NONE, CAN YOU/*.npy"
424,can you sleep through the night?,"NIGHT SLEEP THROUGH, CAN YOU?","/NIGHT SLEEP THROUGH, CAN YOU/*.npy"
425,Can you teach me how to change this bandage?,"BANDAGE CHANGE HOW, SHOW CAN YOU?","/BANDAGE CHANGE HOW, SHOW CAN YOU?/*.npy"
426,can you teach me how to help them with daily exercises?,"DAILY EXERCISES, HELP THEM WITH, TEACH ME CAN?","/DAILY EXERCISES, HELP THEM WITH, TEACH ME CAN?/*.npy"
427,Can you teach me how to help them with their daily exercises?,"DAILY EXERCISES, HELP THEM WITH, TEACH ME CAN?","/DAILY EXERCISES, HELP THEM WITH, TEACH ME CAN?/*.npy"
428,Can you walk comfortably?,WALK COMFORTABLE CAN YOU?,/WALK COMFORTABLE CAN YOU/*.npy
429,Checking your blood pressure regularly is important,BLOOD PRESSURE CHECK REGULAR IMPORTANT,/BLOOD PRESSURE CHECK REGULAR IMPORTANT/*.npy
430,Could I have a nurse help me with bathing?,"BATHING, NURSE ASSIST CAN?","/BATHING, NURSE ASSIST CAN?/*.npy"
431,Could you look into why I am losing my appetite?,"APPETITE LOSING WHY, CHECK CAN YOU?","/APPETITE LOSING WHY, CHECK CAN YOU?/*.npy"
432,could you please fill out this form?,YOU MIND FILL-OUT FORM?,/YOU MIND FILL-OUT FORM?/*.npy
433,could you please give me your ID and insurance information?,YOU CAN GIVE ME YOUR ID AND INSURANCE INFORMATION PLEASE?,/YOU CAN GIVE ME YOUR ID AND INSURANCE INFORMATION PLEASE?/*.npy
434,could you please provide your identification and insurance details?,YOU CAN GIVE ME YOUR ID AND INSURANCE INFORMATION PLEASE?,/YOU CAN GIVE ME YOUR ID AND INSURANCE INFORMATION PLEASE?/*.npy
435,Did notice new symptoms triggers?,SYMPTOMS TRIGGERS NEW NOTICE YOU?,/SYMPTOMS TRIGGERS NEW NOTICE YOU/*.npy
436,Did you arrange for someone to help you at home?,HOME ASSIST SOMEONE ARRANGE YOU?,/HOME ASSIST SOMEONE ARRANGE YOU/*.npy
437,Did you check your blood sugar levels recently?,BLOOD SUGAR LEVELS CHECK RECENT YOU?,/BLOOD SUGAR LEVELS CHECK RECENT YOU/*.npy
438,did you check your cholesterol levels recently?,CHOLESTEROL LEVELS CHECK RECENT?,/CHOLESTEROL LEVELS CHECK RECENT/*.npy
439,did you come here for a follow-up or a new consultation?,YOU COME HERE FOR FOLLOW-UP OR NEW CONSULT?,/YOU COME HERE FOR FOLLOW-UP OR NEW CONSULT?/*.npy
440,Did you complete all the recommended blood tests?,BLOOD TESTS RECOMMENDED ALL COMPLETE YOU?,/BLOOD TESTS RECOMMENDED ALL COMPLETE YOU/*.npy
441,Did you consider changint the lifestyle?,LIFESTYLE CHANGES CONSIDER YOU?,/LIFESTYLE CHANGES CONSIDER YOU/*.npy
442,Did you consider creating a will?,WILL CREATE CONSIDER YOU?,/WILL CREATE CONSIDER YOU/*.npy
443,Did you consider long-term care?,LONG-TERM CARE CONSIDER YOU?,/LONG-TERM CARE CONSIDER YOU/*.npy
444,Did you consider speaking to a genetic counselor regarding the hereditary risks?,GENETIC COUNSELOR HEREDITARY RISKS SPEAK CONSIDER YOU?,/GENETIC COUNSELOR HEREDITARY RISKS SPEAK CONSIDER YOU/*.npy
445,Did you consider talking to someone about your mental health?,MENTAL HEALTH SOMEONE TALK CONSIDER YOU?,/MENTAL HEALTH SOMEONE TALK CONSIDER YOU/*.npy
446,Did you discuss genetic testing with the doctor?,GENETIC TESTING DOCTOR DISCUSS YOU?,/GENETIC TESTING DOCTOR DISCUSS YOU/*.npy
447,Did you discuss the care plan with other family members?,CARE PLAN FAMILY MEMBERS DISCUSS YOU?,/CARE PLAN FAMILY MEMBERS DISCUSS YOU/*.npy
448,Did you discuss the medication plan with the pharmacist?,MEDICATION PLAN PHARMACIST DISCUSS YOU?,/MEDICATION PLAN PHARMACIST DISCUSS YOU/*.npy
449,Did you experience depression recently?,DEPRESSION RECENT EXPERIENCE YOU?,/DEPRESSION RECENT EXPERIENCE YOU/*.npy
450,did you experience nausea after you take this medication?,"MEDICATION THIS, TAKE AFTER NAUSEA EXPERIENCE YOU?","/MEDICATION THIS, TAKE AFTER NAUSEA EXPERIENCE YOU/*.npy"
451,Did you experience these symptoms before?,SYMPTOMS THESE BEFORE EXPERIENCE YOU?,/SYMPTOMS THESE BEFORE EXPERIENCE YOU/*.npy
452,did you fall or got injured recently?,FALL INJURED RECENT YOU?,/FALL INJURED RECENT YOU?/*.npy
453,Did you fast before your blood test?,BLOOD TEST FAST BEFORE YOU?,/BLOOD TEST FAST BEFORE YOU/*.npy
454,Did you have a cancer screening this year?,CANCER SCREENING THIS YEAR HAVE YOU?,/CANCER SCREENING THIS YEAR HAVE YOU/*.npy
455,did you have a dental cleaning in the last six months?,DENTAL CLEANING LAST SIX MONTHS HAVE YOU?,/DENTAL CLEANING LAST SIX MONTHS HAVE YOU/*.npy
456,Did you have a full cardiac evaluation?,CARDIAC EVALUATION FULL HAVE YOU?,/CARDIAC EVALUATION FULL HAVE YOU/*.npy
457,Did you have a neurological evaluation?,NEUROLOGICAL EVALUATION HAVE YOU?,/NEUROLOGICAL EVALUATION HAVE YOU/*.npy
458,Did you have a recent cholesterol screening?,CHOLESTEROL SCREENING RECENT HAVE YOU?,/CHOLESTEROL SCREENING RECENT HAVE YOU/*.npy
459,did you have a surgery before?,SURGERY BEFORE HAVE YOU?,/SURGERY BEFORE HAVE YOU/*.npy
460,Did you have an assessment for rare conditions?,RARE CONDITIONS ASSESSED HAVE YOU?,/RARE CONDITIONS ASSESSED HAVE YOU/*.npy
461,Did you have any fever since the operation?,FEVER SINCE OPERATION HAVE YOU?,/FEVER SINCE OPERATION HAVE YOU/*.npy
462,Did you have any medication allergic reactions in the past?,PAST ANY ALLERGIC REACTIONS MEDICINE YOU?,/PAST ANY ALLERGIC REACTIONS MEDICINE YOU?/*.npy
463,did you have any previous surgeries?,SURGERY PAST YOU HAVE ANY?,/SURGERY PAST YOU HAVE ANY?/*.npy
464,did you have blood test recently?,BLOOD TEST RECENT HAVE YOU?,/BLOOD TEST RECENT HAVE YOU/*.npy
465,Did you have bone density test?,BONE DENSITY TEST HAVE YOU?,/BONE DENSITY TEST HAVE YOU/*.npy
466,Did you have breast cance screening?,BREAST CANCER SCREENED HAVE YOU?,/BREAST CANCER SCREENED HAVE YOU/*.npy
467,Did you have contrast dyes reactions in the past?,CONTRAST DYES REACTION PAST HAVE YOU?,/CONTRAST DYES REACTION PAST HAVE YOU/*.npy
468,Did you have COVID vaccine?,COVID VACCINE HAVE YOU?,/COVID VACCINE HAVE YOU/*.npy
469,Did you have recent diabetes test?,DIABETES TEST RECENT HAVE YOU?,/DIABETES TEST RECENT HAVE YOU/*.npy
470,Did you have recent hearing and vision check?,HEARING VISION CHECK RECENT HAVE YOU?,/HEARING VISION CHECK RECENT HAVE YOU/*.npy
471,Did you have recent STI screening?,STI SCREENED RECENT HAVE YOU?,/STI SCREENED RECENT HAVE YOU/*.npy
472,did you have your eyes checked in the last year?,EYE CHECK LAST YEAR HAVE YOU?,/EYE CHECK LAST YEAR HAVE YOU/*.npy
473,Did you have your hearing and vision checked recently?,HEARING VISION CHECK RECENT HAVE YOU?,/HEARING VISION CHECK RECENT HAVE YOU/*.npy
474,Did you have your thyroid levels checked?,THYROID LEVELS CHECK HAVE YOU?,/THYROID LEVELS CHECK HAVE YOU/*.npy
475,did you miss any doses recently?,DOSES MISS RECENT YOU?,/DOSES MISS RECENT YOU/*.npy
476,Did you monitor your blood pressure at home?,BLOOD PRESSURE HOME MONITOR YOU?,/BLOOD PRESSURE HOME MONITOR YOU/*.npy
477,Did you notice any changes in your menstrual cycle?,MENSTRUAL CYCLE CHANGES NOTICE YOU?,/MENSTRUAL CYCLE CHANGES NOTICE YOU?/*.npy
478,Did you notice any changes in your skin or hair?,SKIN HAIR CHANGES NOTICE YOU?,/SKIN HAIR CHANGES NOTICE YOU?/*.npy
479,Did you notice any joints improvement?,JOINTS IMPROVEMENT NOTICE YOU?,/JOINTS IMPROVEMENT NOTICE YOU/*.npy
480,Did you notice any new triggers for your symptoms?,SYMPTOMS TRIGGER NEW NOTICE YOU?,/SYMPTOMS TRIGGER NEW NOTICE YOU/*.npy
481,Did you notice any patterns or triggers of the symptoms?,SYMPTOM PATTERN TRIGGER NOTICE ANY?,/SYMPTOM PATTERN TRIGGER NOTICE ANY?/*.npy
482,Did you notice any recent changes in your hearing?,HEARING CHANGE RECENT NOTICE YOU?,/HEARING CHANGE RECENT NOTICE YOU/*.npy
483,Did you notice any skin changes or new moles?,SKIN CHANGE MOLES NEW NOTICE YOU?,/SKIN CHANGE MOLES NEW NOTICE YOU/*.npy
484,Did you notice any sleep changes?,SLEEP CHANGES NOTICE YOU?,/SLEEP CHANGES NOTICE YOU/*.npy
485,Did you notice any swelling?,SWELLING NOTICE YOU?,/SWELLING NOTICE YOU/*.npy
486,did you notice any symptoms triggers?,SYMPTOMS TRIGGERS NOTICE YOU?,/SYMPTOMS TRIGGERS NEW NOTICE YOU/*.npy
487,Did you notice any unusual swelling or redness?,SWELLING REDNESS UNUSUAL NOTICE YOU?,/SWELLING REDNESS UNUSUAL NOTICE YOU?/*.npy
488,Did you notice changes in the symptoms?,SYMPTOMS CHANGE NOTICE YOU?,/SYMPTOMS CHANGE NOTICE YOU/*.npy
489,Did you notice changes in urine color or frequency?,URINE COLOR FREQUENCY CHANGE NOTICE YOU?,/URINE COLOR FREQUENCY CHANGE NOTICE YOU/*.npy
490,Did you notice changes in your physical strength?,PHYSICAL STRENGTH CHANGE NOTICE YOU?,/PHYSICAL STRENGTH CHANGE NOTICE YOU/*.npy
491,did you notice changes in your vision or hearing?,VISION HEARING CHANGE NOTICE YOU?,/VISION HEARING CHANGE NOTICE YOU?/*.npy
492,Did you notice infection signs like redness or swelling?,INFECTION SIGNS REDNESS SWELLING NOTICE YOU?,/INFECTION SIGNS REDNESS SWELLING NOTICE YOU/*.npy
493,Did you notice mobility changes?,MOBILITY CHANGE NOTICE YOU?,/MOBILITY CHANGE NOTICE YOU/*.npy
494,Did you notice mood changes?,MOOD CHANGE NOTICE YOU?,/MOOD CHANGE NOTICE YOU/*.npy
495,Did you notice positive changes since the last visit?,POSITIVE CHANGES SINCE LAST VISIT NOTICE YOU?,/POSITIVE CHANGES SINCE LAST VISIT NOTICE YOU/*.npy
496,Did you notice unusual bleeding?,BLEEDING UNUSUAL NOTICE YOU?,/BLEEDING UNUSUAL NOTICE YOU/*.npy
497,did you notice unusual side effects?,SIDE EFFECTS UNUSUAL NOTICE YOU?,/SIDE EFFECTS UNUSUAL NOTICE YOU/*.npy
498,Did you notice unusual swelling?,SWELLING UNUSUAL NOTICE YOU?,/SWELLING UNUSUAL NOTICE YOU/*.npy
499,Did you noticed any new moles or skin changes?,MOLES NEW OR SKIN CHANGE NOTICE YOU?,/MOLES NEW OR SKIN CHANGE NOTICE YOU/*.npy
500,Did you noticee any improvement since your last visit?,IMPROVEMENT NOTICE SINCE LAST VISIT?,/IMPROVEMENT NOTICE SINCE LAST VISIT?/*.npy
501,Did you receive all the vaccines?,ALL VACCINES RECEIVE YOU?,/ALL VACCINES RECEIVE YOU/*.npy
502,Did you receive your yearly flu vaccine?,FLU VACCINE YEARLY RECEIVE YOU?,/FLU VACCINE YEARLY RECEIVE YOU/*.npy
503,Did you recently have the thyroid levels checked?,THYROID LEVELS CHECK RECENT HAVE YOU?,/THYROID LEVELS CHECK RECENT HAVE YOU/*.npy
504,Did you recently start or stop any medications?,MEDICATION RECENT START OR STOP YOU?,/MEDICATION RECENT START OR STOP YOU/*.npy
505,Did you schedule the rehabilitation sessions?,REHABILITATION SESSIONS SCHEDULE YOU?,/REHABILITATION SESSIONS SCHEDULE YOU/*.npy
506,Did you schedule your follow-up appointment yet?,FOLLOW-UP APPOINTMENT SCHEDULE YET YOU?,/FOLLOW-UP APPOINTMENT SCHEDULE YET YOU/*.npy
507,did you schedule your mammogram this year?,MAMMOGRAM THIS YEAR SCHEDULE YOU?,/MAMMOGRAM THIS YEAR SCHEDULE YOU/*.npy
508,Did you start taking any new medications?,MEDICATION NEW START TAKE YOU?,/MEDICATION NEW START TAKE YOU/*.npy
509,Did you take any vaccine in the past year?,VACCINE LAST YEAR TAKE YOU?,/VACCINE LAST YEAR TAKE YOU/*.npy
510,Did you take any vaccine last year?,VACCINE LAST YEAR TAKE YOU?,/VACCINE LAST YEAR TAKE YOU/*.npy
511,Did you travel recently?,TRAVEL RECENT YOU?,/TRAVEL RECENT YOU/*.npy
512,did you try medications for this issue?,THIS ISSUE MEDICATION TRY YOU?,/THIS ISSUE MEDICATION TRY YOU?/*.npy
513,Did you try over-the-counter medications?,OVER-THE-COUNTER MEDICATION TRY YOU?,/OVER-THE-COUNTER MEDICATION TRY YOU/*.npy
514,Did you visit the dentist in the past six months?,DENTIST VISIT LAST SIX MONTHS HAVE YOU?,/DENTIST VISIT LAST SIX MONTHS HAVE YOU/*.npy
515,do i need to be fasting for this test?,"THIS TEST, FASTING NEED I?","/THIS TEST, FASTING NEED I?/*.npy"
516,do i need to fast for this test?,"THIS TEST, FASTING NEED I?","/THIS TEST, FASTING NEED I?/*.npy"
517,Do not eat or drink anything after midnight before your surgery,MIDNIGHT AFTER NO EAT DRINK BEFORE SURGERY,/MIDNIGHT AFTER NO EAT DRINK BEFORE SURGERY/*.npy
518,do these symptoms indicate something serious?,THESE SYMPTOMS SERIOUS INDICATE?,/THESE SYMPTOMS SERIOUS INDICATE?/*.npy
519,Do we need specific equipment for their home care?,"CARE THEIR, EQUIPMENT SPECIFIC HOME NEED?","/CARE THEIR, EQUIPMENT SPECIFIC HOME NEED?/*.npy"
520,Do you attend all your scheduled physical therapy sessions?,PHYSICAL THERAPY SESSIONS SCHEDULED ATTEND YOU?,/PHYSICAL THERAPY SESSIONS SCHEDULED ATTEND YOU/*.npy
521,Do you attend the physical therapy sessions?,PHYSICAL THERAPY SESSIONS ATTEND YOU?,/PHYSICAL THERAPY SESSIONS ATTEND YOU/*.npy
522,Do you attend the recommended therapy sessions?,THERAPY SESSIONS RECOMMEND ATTEND YOU?,/THERAPY SESSIONS RECOMMEND ATTEND YOU/*.npy
523,Do you attend the regular follow-up appointments?,FOLLOW-UP APPOINTMENTS REGULAR ATTEND YOU?,/FOLLOW-UP APPOINTMENTS REGULAR ATTEND YOU/*.npy
524,Do you attend the support groups?,SUPPORT GROUPS ATTEND YOU?,/SUPPORT GROUPS ATTEND YOU/*.npy
525,Do you attend your follow-up appointments?,FOLLOW-UP APPOINTMENTS ATTEND YOU?,/FOLLOW-UP APPOINTMENTS ATTEND YOU/*.npy
526,Do you avoid high-sodium food?,FOOD HIGH-SODIUM AVOID YOU?,/FOOD HIGH-SODIUM AVOID YOU/*.npy
527,Do you avoid smoking and alcohol?,SMOKING ALCOHOL AVOID YOU?,/SMOKING ALCOHOL AVOID YOU/*.npy
528,do you change the bandage frequently?,BANDAGE CHANGE FREQUENTLY YOU?,/BANDAGE CHANGE FREQUENTLY YOU/*.npy
529,Do you change your bandages as directed?,"BANDAGES CHANGE AS DIRECTED, HAVE YOU?","/BANDAGES CHANGE AS DIRECTED, HAVE YOU/*.npy"
530,Do you check wound infection signs?,WOUND INFECTION SIGNS CHECK YOU?,/WOUND INFECTION SIGNS CHECK YOU/*.npy
531,Do you consider participating in a clinical trial?,CLINICAL TRIAL PARTICIPATE CONSIDER YOU?,/CLINICAL TRIAL PARTICIPATE CONSIDER YOU/*.npy
532,Do you do anything to avoid work or home stress?,STRESS WORK HOME AVOID DO ANYTHING YOU?,/STRESS WORK HOME AVOID DO ANYTHING YOU/*.npy
533,Do you do regular breast health self-examinations?,BREAST HEALTH SELF-EXAM REGULAR YOU?,/BREAST HEALTH SELF-EXAM REGULAR YOU/*.npy
534,Do you eat enough protein?,PROTEIN EAT ENOUGH YOU?,/PROTEIN EAT ENOUGH YOU/*.npy
535,Do you eat well to support healing?,"HEALING SUPPORT, EATING WELL YOU?","/HEALING SUPPORT, EATING WELL YOU/*.npy"
536,Do you elevate your legs to reduce swelling?,LEGS ELEVATE REDUCE SWELLING YOU?,/LEGS ELEVATE REDUCE SWELLING YOU/*.npy
537,do you exercise often?,OFTEN EXERCISE YOU DO?,/OFTEN EXERCISE YOU DO?/*.npy
538,Do you exercise regularly?,EXERCISE REGULAR YOU?,/EXERCISE REGULAR YOU/*.npy
539,Do you experienc allergic reactions to past medications?,MEDICATION PAST ALLERGIC REACTIONS EXPERIENCE YOU?,/MEDICATION PAST ALLERGIC REACTIONS EXPERIENCE YOU/*.npy
540,Do you experienc side effects from this medication?,MEDICATION THIS SIDE EFFECTS EXPERIENCE YOU?,/MEDICATION THIS SIDE EFFECTS EXPERIENCE YOU/*.npy
541,Do you experience anxiety about upcoming tests?,TESTS UPCOMING ANXIETY EXPERIENCE YOU?,/TESTS UPCOMING ANXIETY EXPERIENCE YOU/*.npy
542,Do you experience any changes in your mood or behavior?,MOOD BEHAVIOR CHANGE EXPERIENCE YOU?,/MOOD BEHAVIOR CHANGE EXPERIENCE YOU?/*.npy
543,Do you experience any dizziness?,DIZZINESS EXPERIENCE YOU?,/DIZZINESS EXPERIENCE YOU/*.npy
544,Do you experience any nausea?,NAUSEA EXPERIENCE YOU?,/NAUSEA EXPERIENCE YOU/*.npy
545,Do you experience any numbness or tingling?,NUMBNESS TINGLING EXPERIENCE YOU?,/NUMBNESS TINGLING EXPERIENCE YOU?/*.npy
546,Do you experience any stomache?,STOMACHACHE EXPERIENCE YOU?,/STOMACHACHE EXPERIENCE YOU/*.npy
547,Do you experience any stress or anxiety related to your health?,STRESS ANXIETY HEALTH RELATED EXPERIENCE YOU?,/STRESS ANXIETY HEALTH RELATED EXPERIENCE YOU?/*.npy
548,do you experience any urinary problems?,URINARY PROBLEMS EXPERIENCE YOU?,/URINARY PROBLEMS EXPERIENCE YOU?/*.npy
549,Do you experience chest pain during exercise?,CHEST PAIN EXERCISE DURING FEEL YOU?,/CHEST PAIN EXERCISE DURING FEEL YOU/*.npy
550,Do you experience discomfort?,DISCOMFORT EXPERIENCE YOU?,/DISCOMFORT EXPERIENCE YOU/*.npy
551,Do you experience fever or chills?,FEVER CHILLS EXPERIENCE YOU?,/FEVER CHILLS EXPERIENCE YOU/*.npy
552,do you experience joint stiffness in the mornings?,JOINT STIFFNESS MORNING EXPERIENCE YOU?,/JOINT STIFFNESS MORNING EXPERIENCE YOU/*.npy
553,Do you experience medication side effects?,MEDICATION SIDE EFFECTS EXPERIENCE YOU?,/MEDICATION SIDE EFFECTS EXPERIENCE YOU/*.npy
554,Do you experience new symptoms in your condition?,CONDITION SYMPTOMS NEW EXPERIENCE YOU?,/CONDITION SYMPTOMS NEW EXPERIENCE YOU/*.npy
555,Do you experience pain or discomfort?,PAIN DISCOMFORT EXPERIENCE YOU?,/PAIN DISCOMFORT EXPERIENCE YOU/*.npy
556,Do you experience side effects recently?,SIDE EFFECTS RECENT EXPERIENCE YOU?,/SIDE EFFECTS RECENT EXPERIENCE YOU/*.npy
557,Do you experience sleep disturbances?,SLEEP DISTURBANCES EXPERIENCE YOU?,/SLEEP DISTURBANCES EXPERIENCE YOU?/*.npy
558,Do you experience stress because of the condition?,STRESS BECAUSE CONDITION EXPERIENCE YOU?,/STRESS BECAUSE CONDITION EXPERIENCE YOU/*.npy
559,Do you experience these symptoms at a specific time of day?,SYMPTOMS TIME SPECIFIC DAY EXPERIENCE?,/SYMPTOMS TIME SPECIFIC DAY EXPERIENCE/*.npy
560,Do you experience this pain for the first time?,PAIN THIS FIRST TIME EXPERIENCE YOU?,/PAIN THIS FIRST TIME EXPERIENCE YOU/*.npy
561,Do you experience unusual bruising?,BRUISING UNUSUAL EXPERIENCE YOU?,/BRUISING UNUSUAL EXPERIENCE YOU/*.npy
562,Do you face any challenges in your daily routine?,DAILY ROUTINE CHALLENGES FACE YOU?,/DAILY ROUTINE CHALLENGES FACE YOU/*.npy
563,Do you feel any discomfort or pain now?,NOW PAIN DISCOMFORT YOU FEEL?,/NOW PAIN DISCOMFORT YOU FEEL?/*.npy
564,Do you feel any pain?,PAIN FEEL YOU?,/PAIN FEEL YOU/*.npy
565,do you feel any relief from the treatment?,TREATMENT RELIEF FEEL YOU?,/TREATMENT RELIEF FEEL YOU?/*.npy
566,Do you feel comfortable with your healthcare team?,HEALTHCARE TEAM COMFORTABLE YOU?,/HEALTHCARE TEAM COMFORTABLE YOU/*.npy
567,Do you feel confident assisting them with their medical needs?,MEDICAL NEEDS ASSIST THEM CONFIDENT YOU?,/MEDICAL NEEDS ASSIST THEM CONFIDENT YOU/*.npy
568,Do you feel confident in managing your condition at home?,CONDITION HOME MANAGE CONFIDENT YOU?,/CONDITION HOME MANAGE CONFIDENT YOU/*.npy
569,Do you feel confident managing your condition?,CONDITION MANAGE CONFIDENT YOU?,/CONDITION MANAGE CONFIDENT YOU/*.npy
570,Do you feel confident to manage your condition at home?,CONDITION HOME MANAGE CONFIDENT YOU?,/CONDITION HOME MANAGE CONFIDENT YOU/*.npy
